{
  "$schema": "../../../schema/company.schema.json",
  "language": "de",
  "name": "Lisa Chen Design",
  "branding": {
    "accent_color": "#6C63FF",
    "primary_color": "#2D3436",
    "font_preset": "poppins"
  },
  "address": {
    "street": "Schanzenviertel",
    "house_number": "27",
    "postal_code": "20357",
    "city": "Hamburg",
    "country": "Deutschland"
  },
  "contact": {
    "phone": "+49 170 9876543",
    "email": "hello@lisachen.design",
    "website": "www.lisachen.design"
  },
  "tax_id": "42/123/45678",
  "business_owner": "Lisa Chen",
  "bank_account": {
    "bank_name": "N26 Bank",
    "account_holder": "Lisa Chen",
    "iban": "DE45 1001 1001 2345 6789 01",
    "bic": "NTSBDEB1XXX"
  },
  "numbering": {
    "year_format": "short",
    "prefixes": {
      "invoice": "RE",
      "offer": "AN",
      "credentials": "ZD",
      "concept": "KO",
      "documentation": "DOC"
    }
  },
  "structure": {
    "organize_by_year": true
  },
  "default_terms": {
    "hourly_rate": "85.00",
    "currency": "EUR",
    "payment_days": 14,
    "vat_rate": 0,
    "vat_exempt": true,
    "vat_note": "Gemäß §19 UStG wird keine Umsatzsteuer berechnet.",
    "standard_terms": [
      "Gemäß §19 UStG wird keine Umsatzsteuer berechnet.",
      "Zahlbar innerhalb von 14 Tagen.",
      "30% Anzahlung bei Auftragserteilung.",
      "Nutzungsrechte gehen nach vollständiger Bezahlung an den Auftraggeber über."
    ]
  }
}
